<?xml version="1.0" encoding="UTF-8"?>
<!--
To change this license header, choose License Headers in Project Properties.
To change this template file, choose Tools | Templates
and open the template in the editor.
-->


<modelo
    xmlns:xsi='http://www.w3.org/2001/XMLSchema-instance'
    xsi:noNamespaceSchemaLocation='Modelo.xsd'>
    <ejemplo atributo="at">nombrerestringido</ejemplo>
    <curso>1</curso>
    <ciclo>DAW</ciclo>
    <nombreciclo>Desarrollo de Aplicaciones Web</nombreciclo>
    <cod_postal>49600</cod_postal>
    <comentario>FP Superior de DAW, primer curso</comentario>
    <temperatura>20</temperatura>
    <asignatura>
        <codigoasignatura>LMGSI</codigoasignatura>
        <nombreasignatura>Lenguaje de Marcas</nombreasignatura>
    </asignatura>
    <profesor codP="ARN" modulo="LMGSI">Amor Rodr√≠guez</profesor>

</modelo>
